{
  "$schema": "./schema.json",
  "$model": "Apollo adapter manifest for HSBC Sutherland (React). s311-D7: Apollo governs, theirs renders. Each binding maps one Apollo part to the Sutherland component that renders it; `null` means not read yet, never guessed; status climbs only on evidence (rendered needs a side-by-side render on record; accepted needs Dave's word). The unmapped list names every Apollo part this file does not bind. Apollo has no Sutherland mapping yet: no Sutherland component, prop or import name is known. Written #312 N1; four of its rows (cards, list-items, status-indicator, table) replace empty codeBindings placeholder slots from 2026-06-22 that read TODO and named nothing; those slots stay in the metas until the first release whose gate reads this file. Fill it with the kit at adapters/kits/sutherland-react/ on a machine that has Sutherland's source; validate with python3 knowledge/_validate_adapter.py.",
  "manifest": {
    "schemaVersion": "1.0",
    "written": "2026-10-01",
    "by": "#312 lane N1 (Fable); no Sutherland source read",
    "rulings": [
      "s311-D7",
      "s311-D9"
    ],
    "$notes": "Seeds to reconcile at fill time, not carried as rows here because they name Figma variables, not Sutherland's code: knowledge/tokens/_manifests/sutherland-diffs.json (brand and semantic mode diffs) and sutherland-fixtures.json."
  },
  "library": {
    "id": "sutherland-react",
    "name": "HSBC Sutherland (React component library)",
    "runtime": "react",
    "package": null,
    "version": null,
    "source": {
      "repo": null,
      "commit": null,
      "readOn": null
    },
    "$notes": "package, version and source stay null until the manifest is filled beside Sutherland's source (ADR-0008: Sutherland is a consumer and the first live-fire test, never the template)."
  },
  "bindings": [
    {
      "apollo": {
        "meta": "cards"
      },
      "theirs": {
        "component": null,
        "import": null,
        "file": null
      },
      "props": [
        {
          "apollo": "type",
          "theirs": null,
          "hole": "enum",
          "values": {
            "actions": null,
            "basic": null,
            "basic-non-interactive": null,
            "image-with-border": null,
            "image-without-border": null
          },
          "source": null
        },
        {
          "apollo": "state",
          "theirs": null,
          "hole": "enum",
          "values": {
            "default": null,
            "hover": null,
            "pressed": null
          },
          "source": null
        }
      ],
      "slots": [
        {
          "apollo": "content",
          "theirs": null,
          "kind": null,
          "source": null
        }
      ],
      "status": "unverified",
      "source": null,
      "$legacy": {
        "library": "HSBC Sutherland (React component library)",
        "component": "TODO — confirm in Sutherland repo / via Code Connect (may differ from Figma 'Cards')",
        "variantProp": "TODO — the prop that selects type (may not be called 'type')",
        "variantValues": {
          "actions": "TODO",
          "basic": "TODO",
          "basic-non-interactive": "TODO",
          "image-with-border": "TODO",
          "image-without-border": "TODO"
        },
        "$status": "unverified — Sutherland naming not yet inspectable this session; Sutherland token/library migration is Parked until its JSON lands (~late June/early July 2026, see README Parked). Fill from get_code_connect_map once wired.",
        "$source": "to be populated by Code Connect; do not guess"
      },
      "$notes": "Row opened #312 N1. knowledge/components/cards.meta.json carried an empty codeBindings placeholder slot (2026-06-22, every field TODO); it is kept verbatim under $legacy and holds no Sutherland name. Every name on the Sutherland side is null: nothing has been read and nothing is mapped. The kit at adapters/kits/sutherland-react/ fills it on the machine that has Sutherland's source."
    },
    {
      "apollo": {
        "meta": "list-items"
      },
      "theirs": {
        "component": null,
        "import": null,
        "file": null
      },
      "props": [
        {
          "apollo": "type",
          "theirs": null,
          "hole": "enum",
          "values": {
            "account": null,
            "badge": null,
            "item": null,
            "review": null,
            "review-detail": null,
            "transaction": null,
            "bullets": null
          },
          "source": null
        },
        {
          "apollo": "state",
          "theirs": null,
          "hole": "enum",
          "values": {
            "default": null,
            "hover": null,
            "pressed": null,
            "disabled": null,
            "processing": null
          },
          "source": null
        },
        {
          "apollo": "visual",
          "theirs": null,
          "hole": "enum",
          "values": {
            "icon": null,
            "avatar": null,
            "image": null
          },
          "source": null
        },
        {
          "apollo": "detail",
          "theirs": null,
          "hole": "enum",
          "values": {
            "tag": null,
            "status": null
          },
          "source": null
        },
        {
          "apollo": "bulletType",
          "theirs": null,
          "hole": "enum",
          "values": {
            "bullet": null,
            "ordered": null,
            "custom": null
          },
          "source": null
        },
        {
          "apollo": "items",
          "theirs": null,
          "hole": "data",
          "source": null
        }
      ],
      "slots": [],
      "status": "unverified",
      "source": null,
      "$legacy": {
        "library": "HSBC Sutherland (React component library)",
        "component": "TODO — confirm in Sutherland repo / via Code Connect",
        "variantProp": "TODO (the prop selecting row type; may not be called 'type')",
        "$status": "unverified — populate from get_code_connect_map once wired; Sutherland naming may differ from Figma."
      },
      "$notes": "Row opened #312 N1. knowledge/components/list-items.meta.json carried an empty codeBindings placeholder slot (2026-06-22, every field TODO); it is kept verbatim under $legacy and holds no Sutherland name. Every name on the Sutherland side is null: nothing has been read and nothing is mapped. The kit at adapters/kits/sutherland-react/ fills it on the machine that has Sutherland's source."
    },
    {
      "apollo": {
        "meta": "status-indicator"
      },
      "theirs": {
        "component": null,
        "import": null,
        "file": null
      },
      "props": [
        {
          "apollo": "variant",
          "theirs": null,
          "hole": "enum",
          "values": {
            "approved": null,
            "cancelled": null,
            "declined": null,
            "pending": null
          },
          "source": null
        },
        {
          "apollo": "state",
          "theirs": null,
          "hole": "enum",
          "values": {
            "default": null,
            "disabled": null
          },
          "source": null
        },
        {
          "apollo": "label",
          "theirs": null,
          "hole": "string",
          "source": null
        }
      ],
      "slots": [],
      "status": "unverified",
      "source": null,
      "$legacy": {
        "library": "HSBC Sutherland (React component library)",
        "component": "TODO — confirm in Sutherland repo / via Code Connect",
        "$status": "unverified — populate from get_code_connect_map once wired."
      },
      "$notes": "Row opened #312 N1. knowledge/components/status-indicator.meta.json carried an empty codeBindings placeholder slot (2026-06-22, every field TODO); it is kept verbatim under $legacy and holds no Sutherland name. Every name on the Sutherland side is null: nothing has been read and nothing is mapped. The kit at adapters/kits/sutherland-react/ fills it on the machine that has Sutherland's source."
    },
    {
      "apollo": {
        "meta": "table"
      },
      "theirs": {
        "component": null,
        "import": null,
        "file": null
      },
      "props": [
        {
          "apollo": "headerType",
          "theirs": null,
          "hole": "enum",
          "values": {
            "first-row": null,
            "first-column": null,
            "first-row-and-column": null
          },
          "source": null
        },
        {
          "apollo": "orientation",
          "theirs": null,
          "hole": "enum",
          "values": {
            "horizontal": null,
            "vertical": null
          },
          "source": null
        },
        {
          "apollo": "cellAlign",
          "theirs": null,
          "hole": "enum",
          "values": {
            "left": null,
            "right": null
          },
          "source": null
        },
        {
          "apollo": "title",
          "theirs": null,
          "hole": "string",
          "source": null
        },
        {
          "apollo": "rows",
          "theirs": null,
          "hole": "data",
          "source": null
        }
      ],
      "slots": [],
      "status": "unverified",
      "source": null,
      "$legacy": {
        "library": "HSBC Sutherland (React component library)",
        "component": "TODO — confirm in Sutherland repo / via Code Connect",
        "$status": "unverified — populate from get_code_connect_map once wired."
      },